{"authorization":{"authorized_by":"Juss","maximum_files_changed":1,"maximum_lines_changed":40,"mutation_repositories":["jussray/jussray"],"scope_classification":"trivial"},"case_id":"l99-fo-0000","execution_friction":{"failed_ref_rewind_attempt":true,"failed_ref_rewind_effect":"GitHub rejected the non-fast-forward ref update; repository content was not rewound.","noop_commit_effect":"Both later commits contain zero additions, zero deletions, and no changed files.","unexpected_noop_commits":["491bba61797be058632d7c899ce4416b3e075b9c","07ee31f9486293530ea28318927082264684b58c"]},"fix":{"additions":2,"changed_paths":["README.md"],"deletions":1,"first_mutating_commit":"0fb40f87621550dd198cf76461e9731caa30abea","first_mutating_commit_parent":"5cb21686fadd1dddb17aa81be29de4e180b67970","procedure":"goalfix"},"governance_mode":"manual_governance","learning":{"decision":"Keep content fix; preserve process friction in the receipt instead of rewriting history.","limitations":["No canonical Chief runtime selection receipt exists for Case 0.","FCR governance was manual, not automated.","Receipt is not stored in an authorized Git repository.","The SHA-256 below is locally computed and not externally anchored."],"reusable_patterns":["SELECT eligibility is provisional until repository-local policy is read.","Authorization must bind to SHA-bound observation, not narrative.","A successful repair can still expose a process-control failure.","After FIX, verification mode must fail closed against mutation-capable actions."]},"measurement":{"delivery":{"state":"verified"},"ecosystem":{"baseline":{"profile_repo_forks":0,"profile_repo_stars":0,"profile_repo_watchers":0},"causal_claim_allowed":false},"friction":{"evidence":"Two accidental no-op commits were created during verification.","state":"negative_process_signal"},"quality":{"state":"verified"}},"observation":{"alternative_explanations":[],"authorized_subject_sha":"5cb21686fadd1dddb17aa81be29de4e180b67970","cause_hypothesis":"The profile map predated the current L99 identity and was not re-observed afterward.","defect":"Public profile portfolio identity was stale relative to the authoritative StoryEngine repository, which now identifies itself as L99.","defect_reproduced":true},"selection":{"candidate_attempt":2,"canonical_chief_runtime_receipt":"unavailable","repository":"jussray/jussray","selector_mode":"chief-compatible-advisory"},"status":"verified_unanchored_receipt","submission":{"delivered":true,"mode":"owned_repo_direct_main_commit","release_or_deploy":"not_applicable"},"verification":{"authorized_parent_chain_verified":true,"current_main_sha":"07ee31f9486293530ea28318927082264684b58c","current_readme_blob_sha":"5b2e1570b6cb8f177dcd371627af6bbc9cc75394","exact_head_content_verified":true,"files_changed_from_authorized_head":1,"native_ci":"not_present","net_content_changes":3,"playwright":"not_applicable_markdown_only","storyengine_authoritative_identity":"L99","storyengine_link_resolves":true}}